id,name,description,school_level,grade_level,semester,chapter_id,chapter_name,chapter_main,chapter_sub,achievement_id,achievement_name,skill_id,section
9557,그림그래프로 나타내기,"우리나라 권역별 119 구조 건수를 조사하여 표와 그림그래프로 나타내었습니다.\n[권역] : [구조 건수(만 건)]\n- 서울, 인천, 경기 : 31\n- 강원 : 3\n- 대전, 세종, 충청 : 6\n- 대구, 부산, 울산, 경상 : 16\n- 광주, 전라 : 8\n- 제주 : 1\n * 그림그래프에서 ◎은 10만 건, ○은 1만 건을 나타냅니다.\n* 119 구조 건수가 가장 많은 지역은 서울, 인천, 경기 권역이고, 가장 적은 권역은 제주 권역입니다.\n* 대구, 부산, 울산, 경상 권역의 119 구조 건수(16만 건)는 광주, 전라 권역의 119 구조 건수(8만 건)의 2배($16만\div8만=2(배)$)입니다.",초등,초6,1학기,388,그림그래프로 나타내어 볼까요,,여러 가지 그래프,295,실생활 자료를 수집하여 그림그래프로 나타낼 수 있다.,1454,"['자료, 가능성, 확률과 통계']"
616,띠그래프,전체에 대한 각 부분의 비율을 띠 모양에 나타낸 그래프를 띠그래프라고 합니다.\n- 띠그래프는 전체에 대한 각 부분의 비율을 한눈에 알아볼 수 있습니다.,초등,초6,1학기,389,띠그래프를 알아볼까요,,여러 가지 그래프,300,주어진 자료를 띠그래프와 원그래프로 나타낼 수 있다.,1473,"['자료, 가능성, 확률과 통계']"
617,띠그래프로 나타내기,* 띠그래프로 나타내는 방법\n(1) 자료를 보고 각 항목의 백분율을 구합니다.\n(2) 각 항목의 백분율의 합계가 100 %가 되는지 확인합니다.\n(3) 각 항목들이 차지하는 백분율의 크기만큼 선을 그어 띠를 나눕니다.\n(4) 나눈 부분에 각 항목의 내용과 백분율을 씁니다.\n(5) 띠그래프의 제목을 씁니다.,초등,초6,1학기,390,띠그래프로 나타내어 볼까요,,여러 가지 그래프,300,주어진 자료를 띠그래프와 원그래프로 나타낼 수 있다.,1474,"['자료, 가능성, 확률과 통계']"
618,원그래프,전체에 대한 각 부분의 비율을 원 모양에 나타낸 그래프를 원그래프라고 합니다.,초등,초6,1학기,391,원그래프를 알아볼까요,,여러 가지 그래프,300,주어진 자료를 띠그래프와 원그래프로 나타낼 수 있다.,1472,"['자료, 가능성, 확률과 통계']"
619,원그래프로 나타내기,* 원그래프로 나타내는 방법\n(1) 자료를 보고 각 항목의 백분율을 구합니다.\n(2) 각 항목의 백분율의 합계가 100 %가 되는지 확인합니다.\n(3) 각 항목들이 차지하는 백분율의 크기만큼 선을 그어 원을 나눕니다.\n(4) 나눈 부분에 각 항목의 내용과 백분율을 씁니다.\n(5) 원그래프의 제목을 씁니다.,초등,초6,1학기,392,원그래프로 나타내어 볼까요,,여러 가지 그래프,300,주어진 자료를 띠그래프와 원그래프로 나타낼 수 있다.,1471,"['자료, 가능성, 확률과 통계']"
10605,그래프 해석하기,지호네 마을의 가족 수별 가구 수를 조사하여 나타낸 띠그래프입니다.\n- 1인 (27%)\n- 2인 (26%)\n- 3인 (21%)\n- 4인 (19%)\n- 5인 이상 (7%)\n→ 1인 가구 수가 가장 많습니다.\n→ 1인\n→ 1인(27%) 또는 2인(26%) 가구 수는 전체의 53%($27+26=53(%)$)입니다.\n→  3인(21%) 가구 수는 5인 이상(7%) 가구 수의 3배($21\div7=3(배)$)입니다.,초등,초6,1학기,393,그래프를 해석해 볼까요,,여러 가지 그래프,128,"다양한 상황을 그래프로 나타내고, 주어진 그래프를 해석할 수 있다.",687,"['규칙성, 함수']"
10606,원그래프를 보고 해석하기,"현욱이네 집의 쓰레기 종류별 발생량을 조사하여 나타낸 원그래프입니다. 그래프를 해석해 봅시다.\n(음식물 48.3%, 종이류 19.2%, 플라스틱류 15%, 비닐류 9.5%, 기타 8%)\n-가장 많이 발생하는 쓰레기는 음식물입니다.\n-비율이 10% 이상인 쓰레기는 음식물, 종이류, 플라스틱류입니다.\n-종이류 또는 플라스틱류 발생량은 전체의 34.2%입니다.",초등,초6,1학기,393,그래프를 해석해 볼까요,,여러 가지 그래프,128,"다양한 상황을 그래프로 나타내고, 주어진 그래프를 해석할 수 있다.",688,"['규칙성, 함수']"
9590,여러 가지 그래프,"[그림그래프]\n- 수량의 많고 적음을 쉽게 알 수 있습니다.\n- 자료에 따라 상징적인 그림을 사용할 수 있어서 재미있게 나타낼 수 있습니다.\n[막대그래프]\n- 수량의 많고 적음을 한눈에 비교하기 쉽습니다.\n- 각각의 자료의 수량을 비교하기 편리합니다.\n[꺾은선 그래프]\n- 수량의 변화하는 모습과 정도를 쉽게 알 수 있습니다.\n- 시간에 따라 연속적으로 변하는 양을 나타내는데 편리합니다.\n[띠그래프, 원그래프]\n- 전체에 대한 각 부분의 비율을 한눈에 알아보기 쉽습니다.\n- 각 항목끼리의 비율을 쉽게 비교할 수 있습니다.",초등,초6,1학기,394,여러 가지 그래프를 비교해 볼까요,,여러 가지 그래프,128,"다양한 상황을 그래프로 나타내고, 주어진 그래프를 해석할 수 있다.",686,"['규칙성, 함수']"
10403,직육면체의 부피 비교,"* 직접 비교하기\n- 직접 면끼리 대어 봅니다.\n→ 밑면의 가로와 세로, 높이가 각각 다르므로 부피를 비교하기 어렵습니다.\n* 임의 단위를 이용하여 비교하기\n- 모양과 크기가 같은 작은 물건을 담아 봅니다.\n→ 담을 수 있는 물건의 수를 비교하면 가의 부피가 더 큽니다.\n* 모형을 사용하여 비교하기\n- 모양과 크기가 같은 모형을 직육면체 모양으로 쌓아 봅니다.\n→ 사용한 모형의 수를 비교하면 가의 부피가 더 큽니다.\n** 직육면체의 부피를 직접 비교할 수 있는 경우\n- 밑면의 넓이가 같으면 높이가 높을수록 부피가 큽니다.\n- 높이가 같으면 밑면의 넓이가 넓을수록 부피가 큽니다.",초등,초6,1학기,395,직육면체의 부피를 비교해 볼까요,,직육면체의 부피와 겉넓이,200,입체도형의 겉넓이와 부피를 구할 수 있다.,1151,"['도형, 기하']"
10404,$1cm^3$,"부피를 이해하고, 1cm^3, 1m^3의 단위를 알며, 그 관계를 이해한다.",초등,초6,1학기,396,직육면체의 부피를 구하는 방법을 알아볼까요,,직육면체의 부피와 겉넓이,268,"부피를 이해하고, 1cm^3, 1m^3의 단위를 알며, 그 관계를 이해한다.",1368,"['도형, 기하']"
623,직육면체의 부피,$(직육면체의부피)=(가로)\times(세로)\times(높이)=(밑면의넓이)\times(높이)$,초등,초6,1학기,396,직육면체의 부피를 구하는 방법을 알아볼까요,,직육면체의 부피와 겉넓이,269,"직육면체와 정육면체의 부피를 구하는 방법을 이해하고, 이를 구할 수 있다.",1371,"['도형, 기하']"
624,정육면체의 부피,$(정육면체의부피)=(한모서리의길이)\times(한모서리의길이)\times(한모서리의길이)$,초등,초6,1학기,396,직육면체의 부피를 구하는 방법을 알아볼까요,,직육면체의 부피와 겉넓이,269,"직육면체와 정육면체의 부피를 구하는 방법을 이해하고, 이를 구할 수 있다.",1370,"['도형, 기하']"
10405,부피가 $1cm^3$인 쌓기나무의 수를 세어 직육면체의 부피 구하기,부피가 $1cm^3$인 쌓기나무의 수: 12개\n→ 직육면체의 부피: $12cm^3$,초등,초6,1학기,396,직육면체의 부피를 구하는 방법을 알아볼까요,,직육면체의 부피와 겉넓이,268,"부피를 이해하고, 1cm^3, 1m^3의 단위를 알며, 그 관계를 이해한다.",1369,"['도형, 기하']"
625,$1m^3$,"한 모서리의 길이가 1m인 정육면체의 부피를 $1m^3$라 쓰고, 1 세제곱미터라고 읽습니다.",초등,초6,1학기,397,m^3를 알아볼까요,,직육면체의 부피와 겉넓이,268,"부피를 이해하고, 1cm^3, 1m^3의 단위를 알며, 그 관계를 이해한다.",1367,"['도형, 기하']"
626,$1m^3$와 $1cm^3$ 사이의 관계,$1m^3=1000000cm^3$,초등,초6,1학기,397,m^3를 알아볼까요,,직육면체의 부피와 겉넓이,268,"부피를 이해하고, 1cm^3, 1m^3의 단위를 알며, 그 관계를 이해한다.",1366,"['도형, 기하']"
627,직육면체의 겉넓이 ,방법1: 여섯 면의 넓이의 합으로 구하기\n방법2: 세 쌍의 면이 합동인 성질을 이용하여 구하기\n방법3: 두 밑면과 옆면의 넓이의 합으로 구하기,초등,초6,1학기,398,직육면체의 겉넓이를 구하는 방법을 알아볼까요,,직육면체의 부피와 겉넓이,267,"직육면체와 정육면체의 겉넓이를 구하는 방법을 이해하고, 이를 구할 수 있다.",1365,"['도형, 기하']"
628,정육면체의 겉넓이,방법1: 여섯 면의 넓이의 합으로 구하기\n방법2: 한 면의 넓이를 6배 하여 구하기,초등,초6,1학기,398,직육면체의 겉넓이를 구하는 방법을 알아볼까요,,직육면체의 부피와 겉넓이,267,"직육면체와 정육면체의 겉넓이를 구하는 방법을 이해하고, 이를 구할 수 있다.",1364,"['도형, 기하']"
9931,분자끼리 나누어떨어지는 분모가 같은 $(분수)\div(분수)$,* 분모가 같은 $(분수)\div(단위분수)$ 의 계산 방법 \n- 분모가 같은 분수의 나눗셈은 분자끼리 나누어 계산합니다.\n$\frac{▲}{■}\div\frac{1}{■}=▲\div1$,초등,초6,2학기,399,(분수)÷(분수)를 알아볼까요? (1),,분수의 나눗셈,73,"‘(자연수)/(분수)’, ‘(분수)/(분수)’의 계산 원리를 이해하고 그 계산을 할 수 있다.",312,['수와 연산']
705,분자끼리 나누어떨어지지 않는 분모가 같은 $(분수)\div(분수)$,분자끼리 나누어 계산하고 분자끼리 나누어 떨어지지 않으므로 몫을 분수로 나타냅니다.\n$\frac{★}{♥}\div\frac{◆}{♥}=★\div◆=\frac{★}{◆}$,초등,초6,2학기,400,(분수)÷(분수)를 알아볼까요 (2),,분수의 나눗셈,73,"‘(자연수)/(분수)’, ‘(분수)/(분수)’의 계산 원리를 이해하고 그 계산을 할 수 있다.",308,['수와 연산']
706,분모가 다른 $(분수)\div(분수)$,두 분수를 통분하여 분자끼리 나누어 계산합니다.,초등,초6,2학기,401,(분수)÷(분수)를 알아볼까요 (3),,분수의 나눗셈,73,"‘(자연수)/(분수)’, ‘(분수)/(분수)’의 계산 원리를 이해하고 그 계산을 할 수 있다.",309,['수와 연산']
707,$(자연수)\div(분수)$,자연수를 분수의 분자로 나눈 값에 분수의 분모를 곱하여 구합니다.\n$■\div\frac{▲}{●}=(■\div▲)\times●$,초등,초6,2학기,402,(자연수)÷(분수)를 알아볼까요,,분수의 나눗셈,73,"‘(자연수)/(분수)’, ‘(분수)/(분수)’의 계산 원리를 이해하고 그 계산을 할 수 있다.",310,['수와 연산']
708,$(분수)\div(분수)$를 $(분수)\times(분수)$로 나타내는 방법,나눗셈을 곱셈으로 나타내고 나누는 분수의 분모와 분자를 바꾸어 줍니다.\n$\frac{■}{★}\div\frac{▲}{●}=\frac{■}{★}\times\frac{●}{▲}$,초등,초6,2학기,403,(분수)÷(분수)를 (분수)ⅹ(분수)로 나타내어 볼까요,,분수의 나눗셈,73,"‘(자연수)/(분수)’, ‘(분수)/(분수)’의 계산 원리를 이해하고 그 계산을 할 수 있다.",311,['수와 연산']
709,$(분수)\div(분수)$,* $(대분수)\div(분수)$의 계산 방법 \n(1) 대분수를 가분수로 바꾸고 통분하여 분자끼리 나누어 계산하기\n(2) 대분수를 가분수로 바꾸고 분수의 곱셈으로 나타내어 계산하기,초등,초6,2학기,404,(분수)÷(분수)를 계산해 볼까요,,분수의 나눗셈,73,"‘(자연수)/(분수)’, ‘(분수)/(분수)’의 계산 원리를 이해하고 그 계산을 할 수 있다.",313,['수와 연산']
710,$(소수)\div(소수)$,나누는 수와 나누어지는 수에 똑같이 10배 또는 100배를 하여 $(자연수)\div(자연수)$로 계산합니다.,초등,초6,2학기,405,(소수)÷(소수)를 알아볼까요 (1),,소수의 나눗셈,77,"‘(자연수)/(소수)’, ‘(소수)/(소수)’의 계산 원리를 이해하고 그 계산을 할 수 있다.",332,['수와 연산']
711,자릿수가 같은 $(소수)\div(소수)$,-소수를 분수로 바꾸어 분수의 나눗셈으로 계산합니다.\n-나누는 수와 나누어지는 수를 똑같이 10배 또는 100배를 하여 자연수의 나눗셈으로 계산합니다.\n-나누는 수와 나누어지는 수의 소수점을 오른쪽으로 똑같이 옮겨 세로로 계산합니다.,초등,초6,2학기,406,(소수)÷(소수)를 알아볼까요 (2),,소수의 나눗셈,77,"‘(자연수)/(소수)’, ‘(소수)/(소수)’의 계산 원리를 이해하고 그 계산을 할 수 있다.",330,['수와 연산']
712,자릿수가 다른 $(소수)\div(소수)$,-나누는 수와 나누어지는 수를 똑같이 10배 또는 100배를 하여 계산합니다.\n-나누는 수 또는 나누어지는 수가 자연수가 되도록 나누는 수와 나누어지는 수의 소수점을 오른쪽으로 똑같이 옮겨 계산합니다.,초등,초6,2학기,407,(소수)÷(소수)를 알아볼까요 (3),,소수의 나눗셈,77,"‘(자연수)/(소수)’, ‘(소수)/(소수)’의 계산 원리를 이해하고 그 계산을 할 수 있다.",333,['수와 연산']
713,$(자연수)\div(소수)$,-소수를 분수로 바꾸어 분수의 나눗셈으로 계산합니다.\n-나누는 수와 나누어지는 수를 똑같이 10배 또는 100배를 하여 자연수의 나눗셈으로 계산합니다.\n-나누는 수와 나누어지는 수의 소수점을 오른쪽으로 똑같이 옮겨 세로로 계산합니다.,초등,초6,2학기,408,(자연수)÷(소수)를 알아볼까요,,소수의 나눗셈,77,"‘(자연수)/(소수)’, ‘(소수)/(소수)’의 계산 원리를 이해하고 그 계산을 할 수 있다.",331,['수와 연산']
714,몫을 반올림하여 나타내기,나눗셈의 몫이 나누어떨어지지 않아서 정확하게 구할 수 없을 때에는 몫을 반올림하여 나타낼 수 있습니다.,초등,초6,2학기,409,몫을 반올림하여 나타내어 볼까요,,소수의 나눗셈,76,"‘(자연수)/(자연수)’, ‘(소수)/(자연수)’에서 나눗셈의 몫을 소수로 나타낼 수 있다.",329,['수와 연산']
770,나누어 주고 남는 양,-나누어지는 수에서 나누는 수를 몇 번 빼고 남은 수가 '나누어 주고 남는 양'이 됩니다.\n-세로로 계산하여 몫을 자연수 부분까지 구했을 때 남은 수가 '나누어 주고 남는 양'이 됩니다. 이때 나누어 주고 남는 양을 구할 때에는 소수점의 위치에 주의합니다.,초등,초6,2학기,410,나누어 주고 남는 양을 알아볼까요,,소수의 나눗셈,77,"‘(자연수)/(소수)’, ‘(소수)/(소수)’의 계산 원리를 이해하고 그 계산을 할 수 있다.",334,['수와 연산']
1422,쌓기나무로 쌓은 모양과 위에서 본 모양을 보고 쌓은 모양과 쌓기나무의 개수 구하기,nan,초등,초6,2학기,411,쌓은 모양과 쌓기나무의 개수를 알아볼까요 (1),,공간과 입체,197,"쌓기나무로 만든 입체도형의 위, 앞, 옆에서 본 모양을 표현할 수 있고, 이러한 표현을 보고 입체도형의 모양을 추측할 수 있다.",1128,"['도형, 기하']"
10421,어느 방향에서 보았는지 알아보기,nan,초등,초6,2학기,411,쌓은 모양과 쌓기나무의 개수를 알아볼까요 (1),,공간과 입체,187,쌓기나무를 이용하여 만든 모양을 보고 위치나 방향을 이용하여 말할 수 있다.,1097,"['도형, 기하']"
1439,"쌓기나무를 쌓아 만든 모양을 보고 위, 앞, 옆에서 본 모양 그리기",쌓기나무를 앞과 옆에서 본 모양은 각 방향에서 각 줄의 가장 높은 층의 모양과 같습니다.,초등,초6,2학기,412,쌓은 모양과 쌓기나무의 개수를 알아볼까요 (2),,공간과 입체,197,"쌓기나무로 만든 입체도형의 위, 앞, 옆에서 본 모양을 표현할 수 있고, 이러한 표현을 보고 입체도형의 모양을 추측할 수 있다.",1130,"['도형, 기하']"
10747,"위, 앞, 옆에서 본 모양을 보고 쌓은 모양과 쌓기나무의 개수 구하기","앞, 옆에서 본 모양을 보면 쌓기나무는 ②번 자리에 1개, ③번 자리에 1개가 놓이고, ①번 자리에는 쌓기나무가 2개 놓입니다.\n-> 똑같은 모양으로 쌓는 데 필요한 쌓기나무는 4개입니다.",초등,초6,2학기,412,쌓은 모양과 쌓기나무의 개수를 알아볼까요 (2),,공간과 입체,196,쌓기나무로 만든 입체도형을 보고 사용된 쌓기나무의 개수를 구할 수 있다.,1127,"['도형, 기하']"
1440,위에서 본 모양에 수를 쓰는 방법으로 쌓은 모양과 쌓기나무의 개수 구하기,(쌓은 모양의 각 자리에 기호를 붙인 것입니다.)-(위에서 본 모양의 각 자리에 기호를 붙인 것입니다.)-(위에서 본 모양의 각 자리에 쌓은 쌓기나무의 개수를 쓴 것입니다.)\n- 위에서 본 모양에 수를 쓰는 방법 : 사용된 쌓기나무의 개수를 한 가지 경우로만 알 수 있기 때문에 쌓은 모양을 정확하게 알 수 있습니다.,초등,초6,2학기,413,쌓은 모양과 쌓기나무의 개수를 알아볼까요 (3),,공간과 입체,197,"쌓기나무로 만든 입체도형의 위, 앞, 옆에서 본 모양을 표현할 수 있고, 이러한 표현을 보고 입체도형의 모양을 추측할 수 있다.",1131,"['도형, 기하']"
1449,층별로 나타낸 모양을 보고 쌓은 모양과 쌓기나무의 개수 구하기,층별로 나타낸 모양대로 쌓기나무를 쌓으면 쌓은 모양을 만들면 쌓은 모양이 하나로 만들어지기 때문에 쌓은 모양을 정확하게 알 수 있습니다.,초등,초6,2학기,414,쌓은 모양과 쌓기나무의 개수를 알아볼까요 (4),,공간과 입체,197,"쌓기나무로 만든 입체도형의 위, 앞, 옆에서 본 모양을 표현할 수 있고, 이러한 표현을 보고 입체도형의 모양을 추측할 수 있다.",1129,"['도형, 기하']"
1450,여러 가지 모양 만들기,쌓기나무를 각각 4개씩 붙여서 만든 두 가지 모양을 사용하여 여러 가지 새로운 모양을 만들 수 있습니다.,초등,초6,2학기,415,여러 가지 모양을 만들어 볼까요,,공간과 입체,143,쌓기나무를 이용하여 여러 가지 입체도형의 모양을 만들 수 있다.,824,"['도형, 기하']"
10749,쌓기나무 4개로 만들 수 있는 서로 다른 모양 알아보기,쌓기나무 3개로 만들 수 있는 모양에 쌓기나무 1개를 더 붙여 가면서 만들어 봅니다.\n-> 쌓기나무 4개로 만들 수 있는 서로 다른 모양은 모두 8가지입니다.\n-모양을 뒤집거나 돌려서 나오는 모양은 같은 모양이므로 한 번만 셉니다.,초등,초6,2학기,415,여러 가지 모양을 만들어 볼까요,,공간과 입체,186,쌓기나무를 이용하여 여러 가지 입체도형의 모양을 만들 수 있다.,1096,"['도형, 기하']"
1452,곱셈과 나눗셈을 이용한 비의 성질,-비의 전항과 후항에 0이 아닌 같은 수를 곱하여도 비율은 같습니다.\n-비의 전항과 후항에 0이 아닌 같은 수로 나누어도 비율은 같습니다.,초등,초6,2학기,416,비의 성질을 알아볼까요,,비례식과 비례배분,122,"두 양의 크기를 비교하는 상황을 통해 비의 개념을 이해하고, 그 관계를 비로 나타낼 수 있다.",667,"['규칙성, 함수']"
1453,소수(소수:소수)의 비를 간단한 자연수의 비로 나타내기,"비의 전항과 후항에 10, 100, 1000$\cdot\cdot\cdot\cdot\cdot\cdot$을 곱합니다.",초등,초6,2학기,417,간단한 자연수의 비로 나타내어 볼까요,,비례식과 비례배분,124,"비례식을 알고, 그 성질을 이해한다.",675,"['규칙성, 함수']"
1454,분수(분수:분수)의 비를 간단한 자연수의 비로 나타내기,비의 전항과 후항에 두 분모의 공배수를 곱합니다.,초등,초6,2학기,417,간단한 자연수의 비로 나타내어 볼까요,,비례식과 비례배분,124,"비례식을 알고, 그 성질을 이해한다.",676,"['규칙성, 함수']"
1455,소수와 분수(소수:분수)의 비를 간단한 자연수의 비로 나타내기,방법 1. 분수를 소수로 바꾸어 간단한 자연수의 비로 나타내기\n방법 2. 소수를 분수로 바꾸어 간단한 자연수의 비로 나타내기,초등,초6,2학기,417,간단한 자연수의 비로 나타내어 볼까요,,비례식과 비례배분,124,"비례식을 알고, 그 성질을 이해한다.",677,"['규칙성, 함수']"
1456,비례식과 비례식의 외항과 내항,"-비율이 같은 두 비를 기호 '='를 사용하여 3:4 = 6:8과 같이 나타낼 수 있습니다. 이와 같은 식을 비례식이라고 합니다.\n-비례식 3:4 = 6:8에서 바깥쪽에 있는 3과 8을 외항, 안쪽에 있는 4와 6을 내항이라 합니다.",초등,초6,2학기,418,비례식을 알아볼까요,,비례식과 비례배분,124,"비례식을 알고, 그 성질을 이해한다.",674,"['규칙성, 함수']"
10752,비례식의 활용,* 비례식을 이용하여 문제 해결하기\n(1) 구하려고 하는 것을 □라하고 조건에 맞게 비례식을 세웁니다.\n(2) 비례식의 성질을 이용하여 □의 값을 구하여 문제를 해결합니다.,초등,초6,2학기,420,비례식을 활용해 볼까요,,비례식과 비례배분,125,비례식의 성질을 활용하여 간단한 비례식을 풀 수 있다.,679,"['규칙성, 함수']"
1463,비례배분,전체를 주어진 비로 배분하는 것을 비례배분이라고 합니다.,초등,초6,2학기,421,비례배분을 해볼까요,,비례식과 비례배분,126,"비례배분을 알고, 주어진 양을 비례배분 할 수 있다.",680,"['규칙성, 함수']"
1464,비례배분 문제 해결하기,방법 1: 전체를 주어진 비로 배분하기\n방법 2: 비의 성질을 이용하여 비례배분하기,초등,초6,2학기,421,비례배분을 해볼까요,,비례식과 비례배분,126,"비례배분을 알고, 주어진 양을 비례배분 할 수 있다.",681,"['규칙성, 함수']"
1494,원주와 지름의 관계,"원주는 정육각형의 둘레보다 길고 정사각형의 둘레보다 짧음으로 원의 지름의 3배보다 길고, 원의 지름의 4배보다 짧습니다.\n- (원의 지름의 3배) < (원주)\n- (원주) < (원의 지름의 4배)",초등,초6,2학기,422,원주와 지름의 관계를 알아볼까요,,원의 넓이,258,"원주를 구하는 방법을 이해하고, 이를 구할 수 있다.",1341,"['도형, 기하']"
1531,원주율,"원의 지름에 대한 원주의 비율을 원주율이라고 합니다.\n$(원주율)=(원주)\div(지름)$\n원주율을 소수로 나타내면\n3.1415926535897932$\cdot\cdot\cdot\cdot\cdot\cdot$와 같이 끝없이 이어집니다. 따라서 원주율은 필요에 따라 3, 3.1, 3.14 등으로 어림하여 사용하기도 합니다.",초등,초6,2학기,423,원주율을 알아볼까요,,원의 넓이,257,여러 가지 둥근 물체의 원주와 지름을 측정하는 활동을 통하여 원주율을 이해한다.,1337,"['도형, 기하']"
1533,원주를 알 때 원주율을 이용하여 지름 구하기,$(원주율)=(원주)\div(지름)$ → $(지름)=(원주)\div(원주율)$,초등,초6,2학기,424,원주와 지름을 구해 볼까요,,원의 넓이,258,"원주를 구하는 방법을 이해하고, 이를 구할 수 있다.",1339,"['도형, 기하']"
1532,지름을 알 때 원주율을 이용하여 원주 구하기,$(원주율)=(원주)\div(지름)$ → $(원주)=(지름)\times(원주율)$,초등,초6,2학기,424,원주와 지름을 구해 볼까요,,원의 넓이,258,"원주를 구하는 방법을 이해하고, 이를 구할 수 있다.",1338,"['도형, 기하']"
1534,원의 넓이 어림하기,방법 1: 원 안에 있는 정사각형과 원 밖에 있는 정사각형을 이용하여 원의 넓이 어림하기\n방법 2: 모눈종이를 이용하여 원의 넓이 어림하기,초등,초6,2학기,425,원의 넓이를 어림해 볼까요,,원의 넓이,259,"원의 넓이를 구하는 방법을 이해하고, 이를 구할 수 있다.",1345,"['도형, 기하']"
1548,"원을 분할하여 모양이 다른 도형으로 바꾸기, 원의 넓이 구하는 방법",원을 한없이 잘라 이어 붙이면 점점 직사각형에 가까워집니다.,초등,초6,2학기,426,원의 넓이를 구하는 방법을 알아볼까요,,원의 넓이,259,"원의 넓이를 구하는 방법을 이해하고, 이를 구할 수 있다.",1342,"['도형, 기하']"
1574,반지름과 원의 넓이의 관계,"-반지름이 길어지면 원의 넓이도 넓어집니다.\n-반지름이 2배, 3배가 되면 원의 넓이는 4배, 9배가 됩니다.",초등,초6,2학기,427,여러 가지 원의 넓이를 구해 볼까요,,원의 넓이,259,"원의 넓이를 구하는 방법을 이해하고, 이를 구할 수 있다.",1343,"['도형, 기하']"
1576,원기둥의 구성 요소,원기둥에서\n- 밑면: 서로 평행하고 합동인 두 면\n- 옆면: 두 밑면과 만나는 면(굽은 면)\n- 높이: 두 밑면에 수직인 선분의 길이,초등,초6,2학기,428,원기둥을 알아볼까요,,"원기둥, 원뿔, 구",194,"원기둥을 알고, 구성 요소, 성질, 전개도를 이해한다.",1122,"['도형, 기하']"
