id,name,description,school_level,grade_level,semester,chapter_id,chapter_main,chapter_sub,chapter_subsub,achievement_id,achievement_name,skill_id,section
9747,원뿔대-옆면,옆면은 원뿔대의 밑면이 아닌 면이다.,중등,중1,2학기,467,평면도형과 입체도형,입체도형의 성질,회전체,199,회전체의 성질을 이해한다.,1149,"['도형, 기하']"
9748,원뿔대-높이,높이는 원뿔대의 두 밑면 사이의 거리다.,중등,중1,2학기,467,평면도형과 입체도형,입체도형의 성질,회전체,199,회전체의 성질을 이해한다.,1150,"['도형, 기하']"
9074,회전체의 종류,(1) 원기둥\n- 회전시키는 평면도형 : 직사각형\n(2) 원뿔\n- 회전시키는 평면도형 : 직각삼각형\n(3) 원뿔대\n- 회전시키는 평면도형 : 두 각이 직각인 사다리꼴\n(4) 구\n- 회전시키는 평면도형 : 반원,중등,중1,2학기,467,평면도형과 입체도형,입체도형의 성질,회전체,199,회전체의 성질을 이해한다.,1145,"['도형, 기하']"
9073,원뿔대,원뿔대는 원뿔을 밑면에 평행한 평면으로 자를 때 생기는 두 입체도형 중에서 원뿔이 아닌 것이다.,중등,중1,2학기,467,평면도형과 입체도형,입체도형의 성질,회전체,199,회전체의 성질을 이해한다.,1147,"['도형, 기하']"
9077,각기둥의 겉넓이,$(각기둥의 겉넓이)=(밑넓이)\times 2+(옆넓이)$,중등,중1,2학기,468,평면도형과 입체도형,입체도형의 성질,기둥의 겉넓이,200,입체도형의 겉넓이와 부피를 구할 수 있다.,1152,"['도형, 기하']"
9078,원기둥의 겉넓이,밑면인 원의 반지름의 길이가 $r$이고 높이가 $h$인 원기둥의 겉넓이 $S$는\n$S=(밑넓이)\times 2+(옆넓이)=\pi r^2\times2+2\pi r\times h$=$2\pi r^2+2\pi rh$,중등,중1,2학기,468,평면도형과 입체도형,입체도형의 성질,기둥의 겉넓이,200,입체도형의 걸넓이와 부피를 구할 수 있다.,1153,"['도형, 기하']"
9079,각기둥의 부피,"밑넓이가 $S$, 높이가 $h$인 각기둥의 부피 $V$는\n$V=(밑넓이)\times(높이)=Sh$",중등,중1,2학기,469,평면도형과 입체도형,입체도형의 성질,기둥의 부피,200,입체도형의 걸넓이와 부피를 구할 수 있다.,1154,"['도형, 기하']"
9080,원기둥의 부피,밑면인 원의 반지름의 길이가 $r$이고 높이가 $h$인 원기둥의 부피 $V$는\n$V=(밑넓이)\times(높이)=\pi r^2h$,중등,중1,2학기,469,평면도형과 입체도형,입체도형의 성질,기둥의 부피,200,입체도형의 겉넓이와 부피를 구할 수 있다.,1155,"['도형, 기하']"
9081,각뿔의 겉넓이,(각뿔의 겉넓이)=(밑넓이)+(옆넓이),중등,중1,2학기,470,평면도형과 입체도형,입체도형의 성질,뿔의 겉넓이,200,입체도형의 겉넓이와 부피를 구할 수 있다.,1156,"['도형, 기하']"
9082,원뿔의 겉넓이,밑면인 원의 반지름의 길이가 $r$이고 모선의 길이가 $l$인 원뿔의 겉넓이 $S$는\n$S=(밑넓이)+(옆넓이)=\pi r^2+\frac{1}{2}\times2\pi r\times l=\pi r^2+\pi lr$,중등,중1,2학기,470,평면도형과 입체도형,입체도형의 성질,뿔의 겉넓이,200,입체도형의 겉넓이와 부피를 구할 수 있다.,1157,"['도형, 기하']"
9083,뿔대의 겉넓이,(뿔대의 겉넓이)=(두 밑넓이의 합)+(옆넓이),중등,중1,2학기,470,평면도형과 입체도형,입체도형의 성질,뿔의 겉넓이,200,입체도형의 겉넓이와 부피를 구할 수 있다.,1162,"['도형, 기하']"
7862,각뿔의 부피,"각뿔의 밑넓이를 S, 높이를 h, 부피를 V라 하면\n$(각뿔의 부피)=\frac{1}{3}\times(각기둥의 부피)=\frac{1}{3}\times(밑넓이)\times(높이)$\n$V=\frac{1}{3}Sh$",중등,중1,2학기,471,평면도형과 입체도형,입체도형의 성질,뿔의 부피,200,입체도형의 걸넓이와 부피를 구할 수 있다.,1158,"['도형, 기하']"
7863,원뿔의 부피,"밑면인 원의 반지름의 길이가 r이고 높이가 h인 원뿔의 밑넓이를 S, 부피를 V라 하면\n$(원뿔의 부피)=\frac{1}{3}\times(원기둥의 부피)=\frac{1}{3}\times(밑넓이)\times(높이)$\n$V=\frac{1}{3}Sh=\frac{1}{3}\pi r^2h$",중등,중1,2학기,471,평면도형과 입체도형,입체도형의 성질,뿔의 부피,200,입체도형의 걸넓이와 부피를 구할 수 있다.,1159,"['도형, 기하']"
9086,뿔대의 부피,(뿔대의 부피)=(큰 뿔의 부피)-(작은 뿔의 부피),중등,중1,2학기,471,평면도형과 입체도형,입체도형의 성질,뿔의 부피,200,입체도형의 겉넓이와 부피를 구할 수 있다.,1163,"['도형, 기하']"
3288,구의 겉넓이,반지름의 길이가 r인 구의 겉넓이를 S라 하면 $S=4\pi r^2$,중등,중1,2학기,472,평면도형과 입체도형,입체도형의 성질,구의 겉넓이와 부피,200,입체도형의 걸넓이와 부피를 구할 수 있다.,1160,"['도형, 기하']"
7866,구의 부피,반지름의 길이가 r인 구의 부피를 V라 하면 $V=\frac{4}{3}\pi r^3$,중등,중1,2학기,472,평면도형과 입체도형,입체도형의 성질,구의 겉넓이와 부피,200,입체도형의 걸넓이와 부피를 구할 수 있다.,1161,"['도형, 기하']"
7867,줄기와 잎 그림,줄기와 잎을 이용하여 자료를 나타낸 그림,중등,중1,2학기,473,통계,자료의 정리와 해석,줄기와 잎그림,301,"자료를 줄기와 잎 그림,도수분포표, 히스토그램,도수분포다각형으로 나타내고 해석할 수 있다.",1476,"['자료, 가능성, 확률과 통계']"
3289,변량,자료를 수량으로 나타낸 것,중등,중1,2학기,473,통계,자료의 정리와 해석,줄기와 잎그림,301,"자료를 줄기와 잎 그림, 도수분포표, 히스토그램, 도수분포다각형으로 나타내고 해석할 수 있다.",1475,"['자료, 가능성, 확률과 통계']"
9786,줄기와 잎 그림의 특성,줄기와 잎 그림의 특성\n1. 잎의 길이를 통해 자료의 분포 상태를 한눈에 파악하기 쉽다.\n2. 자료의 정보를 잃지 않으므로 원래 자료의 값을 알 수 있다.\n3. 자료의 값을 크기순으로 나열할 수 있으므로 어떤 특정한 위치에 있는 값을 쉽게 구할 수 있다.\n4. 줄기와 잎 그림은 변량이 많으면 잎을 일일이 나열하기가 어려우므로 변량이 적은 자료를 정리할 때 유용하다.,중등,중1,2학기,473,통계,자료의 정리와 해석,줄기와 잎 그림,301,"자료를 줄기와 잎 그림, 도수분포표, 히스토그램, 도수분포다각형으로 나타내고 해석할 수 있다.",1485,"['자료, 가능성, 확률과 통계']"
9797,도수분포표,"주어진 자료를 몇 개의 계급으로 나누고, 각 계급의 도수를 조사하여 나타낸 표로 자료의 전체적인 분포 상태를 알아보기 쉽도록 자료를 분류해 표로 정리한 것이다.",중등,중1,2학기,474,통계,자료의 정리와 해석,도수분포표,301,"자료를 줄기와 잎 그림, 도수분포표, 히스토그램, 도수분포다각형으로 나타내고 해석할 수 있다.",1479,"['자료, 가능성, 확률과 통계']"
9796,도수,각 계급에 속하는 자료의 개수,중등,중1,2학기,474,통계,자료의 정리와 해석,도수분포표,301,"자료를 줄기와 잎 그림, 도수분포표, 히스토그램, 도수분포다각형으로 나타내고 해석할 수 있다.",1478,"['자료, 가능성, 확률과 통계']"
3291,히스토그램을 그리는 순서,"1. 가로축에 각 계급의 양 끝값을 차례로 써넣는다.\n2. 세로축에 도수를 써넣는다.\n3. 계급의 크기를 가로로, 그 계급에 속하는 도수를 세로로 하는 직사각형을 차례로 그린다.",중등,중1,2학기,475,통계,자료의 정리와 해석,히스토그램과 도수분표다각형,301,"자료를 줄기와 잎 그림, 도수분포표, 히스토그램, 도수분포다각형으로 나타내고 해석할 수 있다.",1480,"['자료, 가능성, 확률과 통계']"
9120,도수분포다각형,"다음과 같은 방법으로 나타낸 그래프를 도수분포다각형이라 한다.\n방법(1) : 히스토그램에서 각 직사각형의 윗변의 중앙에 점을 찍는다.\n방법(2) : 그래프의 양 끝에 도수가 0인 계급이 하나씩 있는 것으로 생각하여 그 중앙에 점을 찍는다.\n방법(3) : (1), (2)에 찍은 점을 선분으로 연결한다.",중등,중1,2학기,475,통계,자료의 정리와 해석,히스토그램과 도수분포다각형,301,"자료를 줄기와 잎 그림, 도수분포표, 히스토그램, 도수분포다각형으로 나타내고 해석할 수 있다.",1482,"['자료, 가능성, 확률과 통계']"
9122,도수분포다각형의 특징,(1) 도수의 분포 상태를 연속적으로 관찰할 수 있다.\n(2) 두 개 이상의 자료 분포 상태를 비교할 때 편리하다.\n(3) (도수분포다각형과 가로축으로 둘러싸인 부분의 넓이)=(히스토그램의 직사각형의 넓이의 합),중등,중1,2학기,475,통계,자료의 정리와 해석,히스토그램과 도수분포다각형,301,"자료를 줄기와 잎 그림, 도수분포표, 히스토그램, 도수분포다각형으로 나타내고 해석할 수 있다.",1483,"['자료, 가능성, 확률과 통계']"
9121,히스토그램의 특징,히스토그램은 각 계급의 도수를 직사각형의 세로의 길이로 나타내므로 자료의 분포 상태를 한눈에 알아볼 수 있다.,중등,중1,2학기,475,통계,자료의 정리와 해석,히스토그램과 도수분포다각형,301,"자료를 줄기와 잎 그림, 도수분포표, 히스토그램, 도수분포다각형으로 나타내고 해석할 수 있다.",1481,"['자료, 가능성, 확률과 통계']"
9123,상대도수,상대도수는 도수분포표에서 전체 도수에 대한 각 계급의 도수의 비율이다.\n$(계급의 상대도수)=\frac{(계급의 도수)}{(도수의 총합)}$,중등,중1,2학기,476,통계,자료의 정리와 해석,상대도수와 그래프,302,"상대도수를 구하며, 이를 그래프로 나타내고, 상대도수의 분포를 이해한다.",1486,"['자료, 가능성, 확률과 통계']"
9124,상대도수의 분포표,상대도수의 분포표는 각 계급의 상대도수를 나타낸 표다.,중등,중1,2학기,476,통계,자료의 정리와 해석,상대도수와 그래프,302,"상대도수를 구하며, 이를 그래프로 나타내고, 상대도수의 분포를 이해한다.",1488,"['자료, 가능성, 확률과 통계']"
9126,상대도수의 분포를 나타낸 그래프,상대도수의 분포를 나타낸 그래프는 상대도수의 분포표를 히스토그램이나 도수분포다각형 모양으로 나타낸 그래프다.\n방법(1) : 가로축에 각 계급의 끝값을 적는다.\n방법(2) : 세로축에 상대도수를 적는다.\n방법(3) : 히스토그램이나 도수분포다각형과 같은 방법으로 그린다.,중등,중1,2학기,476,통계,자료의 정리와 해석,상대도수와 그래프,302,"상대도수를 구하며, 이를 그래프로 나타내고, 상대도수의 분포를 이해한다.",1489,"['자료, 가능성, 확률과 통계']"
3823,공학적 도구의 이용,자료를 정리하여 표와 그래프로 나타낼 때 공학적 도구를 이용하면 편리하다.,중등,중1,2학기,477,통계,자료의 정리와 해석,실생활 자료의 정리와 해석,303,공학적 도구를 이용하여 실생활과 관련된 자료를 수집하고 표나 그래프로 정리하고 해석할 수 있다.,1491,"['자료, 가능성, 확률과 통계']"
